Message_id,Movie_name,Message
p1_bolly,Aladin 2009 Hindi 720p DvDRip CharmeLeon SilverRG.txt," Do you know how boring it is to live alone? Watch this, Grandpa? You will be proud. I have mastered this trick now. If you don't study.....how will you go on adventures, like your dad? "
p2_bolly,Aladin 2009 Hindi 720p DvDRip CharmeLeon SilverRG.txt,Bengali? Just hear me out clearly. I guess you are unaware of the fact.....you are now the proud owner of a magical lamp and three wishes. Understand. Come. Come. 
p3_bolly,Alam Ara (1973) Xvid 2cd [DDR].cd1.txt," These are your days to love Whatever happens, you be hale and hearty. You are the beauty's pride. You are a beautiful gesture. You are the secret of love. "
p4_bolly,Alam Ara (1973) Xvid 2cd [DDR].cd1.txt,Voice of my heart. Secret of love. A beautiful gesture. Beauty's pride. You are the beauty's pride. You are a beautiful gesture. Love you with all my heart 
p5_bolly,Alam Ara (1973) Xvid 2cd [DDR].cd1.txt,Secret of love. A beautiful gesture. Beauty's pride. You are the beauty's pride. You are a beautiful gesture. Love you with all my heart Love you with all my soul. 
p6_bolly,Alam Ara (1973) Xvid 2cd [DDR].cd2.txt," Hail Alam Ara! For the worldly comforts, people usually forget that....they won't be here forever. In this short lifespan they have to do such deeds....so that they can face God with pride. Minister of State and Daaraab committed lot of sins....to gain worldly comforts. But the sake of God, I forgive them. "
p7_bolly,Alam Ara (1973) Xvid 2cd [DDR].cd2.txt,Hail Alam Ara! Hail Alam Ara! Myself or the Queen have no right on Alam Ara....more than this good man who took care of an....innocent child and educated her thus making us proud of her. With the consent of elders....l accept the marriage of Alam Ara and Shah Mansoor. Congratulations. 
p8_bolly,Aap.Kaa.Surroor.2007.DVDRip.CD2.Xvid.AC3.txt,Are you doing a world tour with Sameer Siddiqui? Yes of course. Sameer Siddiqui is a great artist. Excellent artist. And we are proud to do our world tour with him We'll soon be doing a big tour with him. What about Himesh Reshamiya 
p9_bolly,Albela (2001) Hindi 720p WEBHDRip x264 AC3 DD 5.1 E-Subs - LOKI - M2Tv.txt," Of course Ma'am. Thank you Tony. I feel proud of myself today. No doubt, I am a guide. I never got to see so much till today. I had a great time. I'm sorry. I'll leave. "
p10_bolly,Albela 1951.txt," But Madam... - We enjoyed, didn't we? Of course Ma'am. - Thank you Tony. I feel proud of myself today. No doubt, I am a guide. I never got to see so much till today. I'm sorry. I'll leave. What is it? - I want to say something. "
p11_bolly,Albela [2001] DVDRip_AC3_SuB_XviD [Dus].txt," Of course Ma'am. Thank you Tony. I feel proud of  myself today. No doubt, I am a guide. I never got to see so much till today. I'm sorry. I'll leave. - what is it? - I want to say something. "
p12_bolly,Alibaba Aur 40 Chor (1980) DVD-RIP by aPn.txt," He has called me over to take my share of the inheritance. Congratulations, Alibaba. You are making Baba's dreams come true. I am proud of you. What brings you here? I wish to help you do your good deed. "
p13_bolly,All is Well 2015 Hindi 720p DvDRip x264 AC3 5.1 - Hon3y.txt,Your mother had already given up on me.....because I was useless. hopeless. But you were the apple of her eye. My child will make me proud..look after me. He'll support in my old-age. But this kid..left her all alone. 
p14_bolly,Allah Rakha.1986.DvdRip.1.3.Xvid.E-Subs.KiL0.DUS.txt," Commissioner, for which crime do you want to arrest me now? I have come to meet Salma Does your pride gets effected in calling her as your wife? Have you come to talk about your son's cassette? When she comes, please tell her that I came to meet her "
p15_bolly,Aloo Chaat - DVDRip - XviD - 1CDRip - [DDR].txt," What went wrong? Why did you disturb my sunbathing? How dare you! You are asking me, why did I bring you down? Oh, that. You should be proud. Your soon to-be wife has such a beautiful body. You aren't ashamed. You are feeling proud of it, instead? "
p16_bolly,Aloo Chaat - DVDRip - XviD - 1CDRip - [DDR].txt," Oh, that. You should be proud. Your soon to-be wife has such a beautiful body. You aren't ashamed. You are feeling proud of it, instead? Yes. This is my life. -But.. but this is India. India. "
p17_bolly,Amanat (1955) Xvid 2cd_Eng Subs [DDR].txt,Get out of here. - Let's go. You are  insulting us! You are such a lowly person! Don't be so proud of your money! Shameless person. He is on  cloud nine - That's what I am saying! 
p18_bolly,Amanat (1955) Xvid 2cd_Eng Subs [DDR].txt,"   Killing a witch like you it's no sin! Get lost! Your father on whom you took pride has died! Mother! - No...You had  told me about that mill... I've decided to buy it. I knew, you'd come to me one day. "
p19_bolly,Amanat (1955) Xvid 2cd_Eng Subs [DDR].txt," Even I was furious hearing the lecture. Whose lecture? - Our new manager, Mr Naresh. He doesn't have any humanity. He is so proud of his  wealth. I'll leave. - Do come again. Where's your house? - It's nearby. "
p20_bolly,Amanat_1994_1CD_DVDRip_avi_M2TV.txt," Thakur, fear the God. You won't know when He strikes. Too much of pride will destroy you! Remember, they are dying of thirst. Their curse..will destroy your happiness. I curse you! "
p21_bolly,Amanat_1994_1CD_DVDRip_avi_M2TV.txt," Look at this. Rajeshwar, have a look..He has sold off his land to Thakur Lankeshwar In exchange the Thakur will provide water.... to us for a month Bravo, my son! I'm proud of you! Go on, son! Our good wishes are with you Tea! Hot tea! "
p22_bolly,Amanat_1994_1CD_DVDRip_avi_M2TV.txt," You said, the entire village had drowned in tears And now when I've got the tube well for your village..your conscience pricks you You speak of pride now?! I'm not donating this tube well to you..it's like a loan. When you are capable to repay..you can come over. He's right. We too take things on credit from each other. "
p23_bolly,Amber - 1952 - You tube Video Running Time 02.25.16.txt," - You think this is a joke? - After all, I'm a clown. King, he is the killer of your son and my father. Raj. Today you have made your brave father proud. Child Amber, you're the rightful owner of the throne and of this Raj. King, me? "
p24_bolly,Amma 1986.txt," Kamli, lift up her veil. Move back! Sister, don't be so proud of your wealth. I came here with my daughter-in-law to give your respect....and not to degrade ourselves. Take back your gift. "
p25_bolly,Amma 1986.txt," Father, don't be worried. Your son is going to die for the sake of our country's freedom. You should be proud of me. Yes, my son. I am proud! I am very proud. But after you are hanged will these people allow us to take you away....home for the last rites? "
p26_bolly,Amma 1986.txt," Your son is going to die for the sake of our country's freedom. You should be proud of me. Yes, my son. I am proud! I am very proud. But after you are hanged will these people allow us to take you away....home for the last rites? No, father. Why is that necessary? "
p27_bolly,Amrapali.txt,Because you are from Vaishali? But don't forget that you are the Royal mother of Magadh. The pride of Magadh is your pride. The victory of Magadh is your victory. And it's my duty to lay my life for both of them. 
p28_bolly,Aarakshan 2011 Hindi 720p DvDRip x264 AC3 5.1.. (1).Hon3y.txt," Deepak Kumar......I'm extremely pleased to appoint you as a Junior Lecturer at S.T.M. Congratulations. Thank you, Sir. I'm proud of you. - Come on. - This is where Deepak lives? Why didn't you tell me you live in such a narrow lane? "
p29_bolly,Aarakshan 2011 Hindi 720p DvDRip x264 AC3 5.1.. (1).Hon3y.txt," See, I am a teacher. My responsibility towards each child is the same. Proud as I am of my successful and privileged students...lam equally concerned about the weaker and...poor students of our society. Two Indias co-exist in our country...Mr. Arvind Kamal. And, if we want our country to genuinely progress, then...we shall have to eliminate the gap between the two. "
p30_bolly,Aarakshan 2011 Hindi 720p DvDRip x264 AC3 5.1...Hon3y.txt," Deepak Kumar......I'm extremely pleased to appoint you as a Junior Lecturer at S.T.M. Congratulations. Thank you, Sir. I'm proud of you. - Come on. - This is where Deepak lives? Why didn't you tell me you live in such a narrow lane? "
p31_bolly,Aarakshan 2011 Hindi 720p DvDRip x264 AC3 5.1...Hon3y.txt," See, I am a teacher. My responsibility towards each child is the same. Proud as I am of my successful and privileged students...lam equally concerned about the weaker and...poor students of our society. Two Indias co-exist in our country...Mr. Arvind Kamal. And, if we want our country to genuinely progress, then...we shall have to eliminate the gap between the two. "
p32_bolly,Andaz_1994-By_TS_Team_RTW.txt," Govind is my student, Jaya. and this man was a traitor. I could've retaliated to Govind's impudence. But that wouldn't shatter his pride. in fact, it would've given rise to a feeling of vengeance in him. Punishment doesn't change a student. "
p33_bolly,Andolan (1995) 1.3 DVDrip- XviD- ESubs- [Team Bindass].txt," He was  always very sick. And one day, he just died. There I was on the streets. Orphaned. And I starved. A peasant's son is too proud to beg. Hungry and starved, I fainted one day. On the streets. In this city   millions there was at least one kind soul. "
p34_bolly,Andolan (1995) 1.3 DVDrip- XviD- ESubs- [Team Bindass].txt,Now I know why you decided against going to  Delhi all of a sudden. I won't take the money. I know you're very proud. In all these years...you have never taken a penny from me. - But don't I have a right overyou? -You have all the right. But this is your superannuation fund. Use it to go to  Delhi. 
p35_bolly,Angulimala - 1960 - You tube Video Running Time 02.06.52.txt," Ask the royal astrologer for his horoscope. Here, your darling is ten days old now. Bless him. Long live, my son. Make your clan proud. - Greetings, royal priest. - Greetings, royal astrologer. Come in, please. "
p36_bolly,Angulimala - 1960 - You tube Video Running Time 02.06.52.txt," I offer you my life. Make my son immortal May he light the torch of peace in this world May he make his country proud I know. It's my son, Ahinsak. You don't wear good clothes. Why? "
p37_bolly,Aarya-2 (1).1CD.DvD.X264_2.txt," Father-in-law! # I'm a foreigner, I came from foreign... # # For proud young men, I left Washington... # # Got fed up boarding airbus... # # I started liking red bus... # "
p38_bolly,Anjaam 1CD 1994 {www.desibbrg.com} ~ Da Xclusives.txt,its just paper to me but they can turn any no into a yes Really? -if this is not enough I have more You have that much pride in your money Not pride but proud just like you are of your beauty And you came to bid on my beauty 
p39_bolly,Anjaam 1CD 1994 {www.desibbrg.com} ~ Da Xclusives.txt,Really? -if this is not enough I have more You have that much pride in your money Not pride but proud just like you are of your beauty And you came to bid on my beauty Think what ever you want 
p40_bolly,Anjaana (1969).txt," Do you think your son is such a fool....to let go of this golden chance, Daddy?. Fool, I want God to give a son like you to everyone. With his ability, he improved the business in a short while....and his decency has made me proud. Not only son, God has given me everything. He gave me a divine friend. "
p41_bolly,Anjaana (1969).txt," Diwan sir, love is sublime and doesn't believe in cast or creed. Love is the boon of nature....according to which the rich and the poor are equal. if love is a crime, then I'm proud of my love. Shut up. - Diwan sir. I don't know what stopped me, Diwan sir. "
p42_bolly,Ankahee 2006 Hindi 480p DvDRip x264 AC3 5.1...Hon3y.txt," We have to win this case at any cost. Come! Case. Till yesterday the relation which I was proud about. Today it has become a case. You go, Shilpa. "
p43_bolly,Ankahee.2006.DVDRip.XviD-BrG.CD2.txt," We have to win this case at any cost. Come! Case. Till yesterday the relation which I was proud about. Today it has become a case. You go, Shilpa. "
p44_bolly,Anpadh 1962.txt,I caused pain to your delicate heart. I'll compensate it. I'll teach you personally. I'll make you a worthy person that......people feel proud of you one day. Smile once......which will brighten up your Deepak's life. Just once for your Deepak. 
p45_bolly,Anpadh 1962.txt," I'll avenge my humiliation. Don't be foolish. Come to senses. If you can not make your family proud, atleast don't disgrace it. Go away from here. Murder... murder... What are you waiting for? "
p46_bolly,Antardwand - DVDRip - XviD - 1CDRip - [DDR].txt," The police are on their way. All of you get out of here, or else you will be behind bars! Mr. Sahi, it is against the pride of our village! I don't do such buffoonery like you. You people are into this racket. "
p47_bolly,Anth 1994 Hindi 480p DvDRip x264 AC3 5.1...Hon3y.txt," But bribe has shut his mouth. I agree. But what can I do all alone? I used to be proud of you. Because you were a But today I feel ashamed to call you my father. Enough, dear. I was helpless. "
p48_bolly,Anupama_1966_EN.txt," I know now for sure that you haven't recognised me. I am Aruna's friend, Shanta. - Oh yes! Shanta. Tell me, what are you so proud of? Everyone gets married.  And everyone becomes a father too. You are badly mistaken. "
p49_bolly,Anupama_1966_EN.txt," And everyone becomes a father too. You are badly mistaken. Neither have I become proud, nor am I going to be a father. Trying to hide? - Not at all. You are shooting in the dark. "
p50_bolly,Anupama_1966_EN.txt,No. - Damn you! You have truly disappointed me. - Why? I thought you will come back and make me proud. But you didn't do a thing! Come inside. 
p51_bolly,Anupama_1966_EN.txt," Yes, you'd see what a good sense of humor she has. I can't be serious like you every time. Ma, they are so rich, but not at all proud. They are very nice people. Gauri, never form an opinion about someone so soon. "
p52_bolly,Anupama_1966_EN.txt,I disgrace myself today My heart skips a beat If I begin to feel proud Why did you give me I feel flushed seeing my glowing face 
p53_bolly,Anwar (2007) - DVDRip - XviD - 5.1 AC3 - ESub [DDR].txt,I have demanded 2 crore rupees for this  temple.  Clap! So that the honour and pride of this  temple can be returned.  Clap! Brothers!  Welcome this brave boy with a round of  applause.
p54_bolly,Apaharan 2005 Hindi 720p BRRip CharmeLeon SilverRG.txt," Move. Sir, this is Professor Shastri's.. - Of course, I know him. Ηe has chosen the right field. Ηe'll make his father proud. Who else have you all kidnapped? Sir, should we make his report? "
p55_bolly,Apaharan 2005 Hindi 720p BRRip CharmeLeon SilverRG.txt,One has to pay a price for the truth. You are a true Μuslim. Αnd I've always been proud to be your wife. You can't shutter my pride. I won't let you lose. 
p56_bolly,Apaharan 2005 Hindi 720p BRRip CharmeLeon SilverRG.txt,You are a true Μuslim. Αnd I've always been proud to be your wife. You can't shutter my pride. I won't let you lose. Please don't bother about your son's life or mine. 
p57_bolly,Apaharan 2005 Hindi 720p BRRip CharmeLeon SilverRG.txt," No, I wasn't worthy of you. I look too long to understand you. I thought, one day I'd succeed and do you proud. But I kept sinking deeper into hell. It doesn't matter. I am proud of who you are. "
p58_bolly,Apaharan 2005 Hindi 720p BRRip CharmeLeon SilverRG.txt," I thought, one day I'd succeed and do you proud. But I kept sinking deeper into hell. It doesn't matter. I am proud of who you are. Αnd listen, son, don't repent. lnstead do something to atone for what you did. "
p59_bolly,Apna Desh 1972 Hindi 480p DvDRip x264 AC3 5.1...Hon3y.txt," Yes, I am a thief, a bandit, a looter. And they all are our society's ideals. They are the pride of our society, our leaders. And he's another thief. Akash's accomplice. Their group leader! "
p60_bolly,Apna Sapna Money Money - 1CD Rip - BBrG.txt," Everything in the world is under my control Don't take me to be a statue Why are you so proud about your beauty, love? A lamp has to light up and fade away Why don't you understand that? "
p61_bolly,Apna Sapna Money Money - 1CD Rip - BBrG.txt," Why are you shouting? Call up Carlos again and ask him. Shut up! Say something once that makes me proud of you, not worry about you. You want to ruin my impression on my first job? Try to recollect! "
p62_bolly,Apna Sapna Money Money 2006 Hindi 720p DvDRip x264 AC3 5.1...Hon3y.txt," Everything in the world is under my control Don't take me to be a statue Why are you so proud about your beauty, love? A lamp has to light up and fade away Why don't you understand that? "
p63_bolly,Apna Sapna Money Money 2006 Hindi 720p DvDRip x264 AC3 5.1...Hon3y.txt," Why are you shouting? Call up Carlos again and ask him. Shut up! Say something once that makes me proud of you, not worry about you. You want to ruin my impression on my first job? Try to recollect! "
p64_bolly,Apne 2007 Hindi 720p DvDRip x264 AC3 5.1...Hon3y.txt," Come. Our dear ones are close to us. We are proud of you, son. Today, father touched me after many years. I am very happy! "
p65_bolly,Apne 2007 Hindi 720p DvDRip x264 AC3 5.1...Hon3y.txt,Father spoke? What did he say? He said that a son's victory is....victory for his father too. I am proud of my Angad. Simran. - Yes? Have you brought money for Kara“? - Yes. 
p66_bolly,Apne 2007 Hindi 720p DvDRip x264 AC3 5.1...Hon3y.txt," Ladies and gentlemen. Baldev Singh has come! He won the first silver medal for....boxing for India and made India proud! Ehsan, am I dreaming? Come on! Come on! "
p67_bolly,Apne 2007 Hindi 720p DvDRip x264 AC3 5.1...Hon3y.txt," You can ban me but you can't....ban the spirit in me. My son Angad will come. He will bring my pride back. I challenge you. Grandma, get me a Play station from Germany. "
p68_bolly,Apne 2007 Hindi 720p DvDRip x264 AC3 5.1...Hon3y.txt," They are very hi-tech and we are..Ehsan, did you hear that? Even though his father was..ill he went there to see boxing..in the Western. That is the spirit. I'm proud of you boy! Sir, how will we match them? For technology I'm taking you to Delhi. "
p69_bolly,Apne 2007 Hindi 720p DvDRip x264 AC3 5.1...Hon3y.txt,Because no one would put ourselves....through what we go through....if it wasn't for the money. That is why we fight. I fight for the pride of my country. I fight for the pride of my country. He got scared of my son. 
p70_bolly,Apne 2007 Hindi 720p DvDRip x264 AC3 5.1...Hon3y.txt,That is why we fight. I fight for the pride of my country. I fight for the pride of my country. He got scared of my son. What did he say? - Don't know. 
p71_bolly,Apne 2007 Hindi 720p DvDRip x264 AC3 5.1...Hon3y.txt," Ladies and gentlemen..Please welcome to the centre of the ring....brother of the miracle boy, Angad Chaudhary Singh. Many people are hoping and praying. Pride, honour, revenge, determination.....all of them are effective here today. It feels like a funeral in here tonight. You can feel it to be pin-drop. "
p72_bolly,Apne 2007 Hindi 720p DvDRip x264 AC3 5.1...Hon3y.txt," Son, parents have been doing....this for their children for ages. Son, the children do something.....like what you have clone for their parents....in today's world you don't get to see it much. I am proud of you. Cheese! "
p73_bolly,Apne~2007~CD1.txt," Come. Our dear ones are close to us. We are proud of you, son. Today, father touched me after many years. I am very happy! "
p74_bolly,Apne~2007~CD1.txt,Father spoke? What did he say? He said that a son's victory is....victory for his father too. I am proud of my Angad. Simran. - Yes? Have you brought money for Karan? - Yes. 
p75_bolly,Apne~2007~CD1.txt," Ladies and gentlemen. Baldev Singh has come! He won the first silver medal for....boxing for india and made India proud! Ehsan, am I dreaming? Come on! Come on! "
p76_bolly,Apne~2007~CD1.txt," You can ban me but you can't....ban the spirit in me. My son Angad will come. He will bring my pride back. I challenge you. I challenge you. Grandma, get me a Playstation from Germany. "
p77_bolly,Apne~2007~CD1.txt," They are very hi-tech and we are..Ehsan, did you hear that? Even though his father was ill he went....there to see boxing in the Western. That is the spirit. I'm proud of you boy! Sir, how will we match them? For technology I'm taking you to Delhi. "
p78_bolly,Apne~2007~CD2.txt,Because no one would put ourselves....through what we go through....if it wasn't for the money. That is why we fight. I fight for the pride of my country. I fight for the pride of my country. He got scared of my son. 
p79_bolly,Apne~2007~CD2.txt,That is why we fight. I fight for the pride of my country. I fight for the pride of my country. He got scared of my son. What did he say? - Don't know. 
p80_bolly,Apne~2007~CD2.txt," Ladies and gentlemen..Please welcome to the centre of the ring....brother of the miracle boy, Angad Chaudhary Singh. Many people are hoping and praying. Pride, honour, revenge, determination all .... of them are effective here today. It feels like a funeral in here tonight. You can feel it to be pin-drop. "
p81_bolly,Apne~2007~CD2.txt," Son, parents have been doing this for their children for ages. Son, the children do something....like what you have done for thier parents....in today's world you don't get to see it much. I am proud of you. Cheese! Smile. "
p82_bolly,Aradhana 2.txt,And I request the chief guest to start the function. In today's function we have gathered to congratulate......those brave young pilots......who have risked their lives for their country And in the process they have set such standards of bravery......that every citizen of India is proud of them. The State has already honoured them and will continue to do so. But I believe that there is no greater award......than the love and good wishes of the people. 
p83_bolly,Aradhana 2.txt,Mother! My son! Today I can hold my head up with pride and say......that I do not know how much penance I have done......in order to become the son of a great mother like you. 
p84_bolly,Arjun 1985 Hindi 480p DvDRip x264 AC3 5.1...Hon3y.txt," Yes, Arvind. Trivedi is finished now. Arjun, I'm proud of you. You really did very courageous work. You gave me this courage, Mr. Chowgale. "
p85_bolly,Arpan (1983) - DVDrip - XviD - Esubs [Desi Doctor].txt," I'll commit suicide, doctor has said that nothing can be done. No Vinney, every thing will be alright. I had promised you that, I will save the pride of your family. So today, I'm going to do just the same, there is no other way. This is Shobha. - Why did you call me so late, what should......I do for you? - I'm ready to get married, "
p86_bolly,Arpan (1983) - DVDrip - XviD - Esubs [Desi Doctor].txt," J.K. Kidnapped me with the help of some goons, because he......wanted to take revenge on Shobhaji at any cost. Shobhaji met him, but he made a deal that she should marry him......immediately or else he won't allow us to marry. In this situation, to save the pride of your family and......for my sake & Vinney's, she deliberately strangled her love......and set foot in J. K's trap. Not just that, people started blaming her for getting married......to J.k. For his money. But this is not true. She transferred the money to J.K.'s younger brother. "
p87_bolly,Arpan (1983) - DVDrip - XviD - Esubs [Desi Doctor].txt," You don't know the reality. You are blaming the one whom we......should have worshipped. - Worshiping that rascal? Mother you have forced me to reveal the truth. This girl, your daughter and my sister. Ask her what Shobha......has done to save the pride of our family. She was pregnant, before marriage. I had done a mistake, mother. "
p88_bolly,Arpan (1983) - DVDrip - XviD - Esubs [Desi Doctor].txt," If Shobha wouldn't have married J.K. Vinney and Rakesh wouldn't......have got married. - But why? Since, Shobha had insulted J.K. He wanted to take revenge, after......marriage he has harassed her a lot. She has gone through a lot. And this, she has done just for your sake, to save your pride. And I have always thought wrong about her, and blamed her I was wrong. I've committed a crime. God shouldn't forgive me. "
p89_bolly,Aryan (2006) 1CD.txt," Without you, my heart is so helpless I worship you for no want,  I consider you god, you are my pride O my beautiful sweetheart, take my heart I want nothing else in return, just give me your heart "
p90_bolly,Asambhav.2004.CD1.Hindi.DVDRip.EngSub-BrG.txt," It's a mission that is given to the entire army By entrusting me the responsibility, you have honoured me I won't disappoint you. I will protect the pride of my country Prepare to leave tonight This contains your new identity cards, credit cards...documents, ticKets and passport "
p91_bolly,Asambhav.2004.CD2.Hindi.DVDRip.EngSub-BrG.txt," This embassy has never given the Indian government any cause for complaint Twice, we have won the award for being the best Indian embassy I was proud of the embassy! But one of you has cast a slur on our pride and honour...and given us a bad name! Captain Arya has proof. He's a special agent of the Indian army "
p92_bolly,Asambhav.2004.CD2.Hindi.DVDRip.EngSub-BrG.txt," Twice, we have won the award for being the best Indian embassy I was proud of the embassy! But one of you has cast a slur on our pride and honour...and given us a bad name! Captain Arya has proof. He's a special agent of the Indian army New Delhi has sent him here on a special assignment "
p93_bolly,Asli Naqli (1986) - DVDRip - XviD - 2CDRip - SUBS - Alice TDBB.txt," No matter how much a person changes himself..''..his cunningness doesn't vanish.'' Even when the strength is destroyed. Pride doesn't become extinct. if a crow tries to apes a swan, it won't be called a swan. if a crow tries to apes a swan, it won't be called a swan. "
