Message_id,Movie_name,Message
p1475_bolly,KOHINOOR 1960.ENG.txt," Go out, you don't have the strength to bear another attack! Shut the door with your wounded hands my friend. A person should act wisely. Such a tall, strong man......with so much pride, having such long moustaches......should have been handled carefully, my girl. Grab him with both hands. You won't find such a handsome man again. Remember girl, if you fail this time...for the rest of your life you will be suffering, and selling peanuts. "
p1476_bolly,KOHINOOR 1960.ENG.txt,Your Holiness...Problems of you two lovers has destroyed me. My peace of mind is disturbed. Get a whip. I'll treat that proud girl a lesson. No Holiness. - Shut up! No Holiness...Water. 
p1477_bolly,KOHINOOR 1960.ENG.txt," Don't you feel ashamed to talk of love you witch. I'm not a witch, I'm a dancer. You had to show your low status! If you are so proud of your love......then burn your hands which have blinded your love. This too is a manifestation of love. - You are shameless! Get out. "
p1478_bolly,Kaagaz Ke Fools 2015 Hindi 720p DvDRip x264 AC3 5.1 - Hon3y.txt,Nikki! I've made great red kidney beans. You will feel proud for having husband like me. Hope we are not late. How long will you delay? What'? What do you mean'? 
p1479_bolly,Kaagaz Ke Fools 2015 Hindi 720p DvDRip x264 AC3 5.1 - Hon3y.txt," You know, I didn't know this was your novel. I was really shocked. But then I thought, maybe you have changed your mind. I am so proud of you. It's really good. This is my novel'? Of course, it is. "
p1480_bolly,Kaajal.1965.DVDRiP.XviD.M2TV.By.IndianHacker.txt," My husband can't be blamed for it. Inspector, I know...He loves me deeply. Any woman would be proud.. to possess such a husband..We were only able to record this much when she fainted. She still hasn't regained consciousness. I feel like mother I too will die pining for you. "
p1481_bolly,Kaamyaab-2020-Hindi.txt," Didn't I tell you, you rascal? My love has brought my son back from the dead! Had your father been alive today...He would've been really proud! Tell me who killed my father? Or I will...Feed you to the dogs! Take that! "
p1482_bolly,Kaante 2002 Hindi 720p DvDRip CharmeLeon SilverRG.txt," Oh what happened, Oh God! Was it your fault or mine? Was it your pride or mine? O God, I wouldn't have been so bad.....hadn't you been so heartless. Just tell me, what did you get by this? "
p1483_bolly,Kaash (1987) 1CD- DVDrip- XviD- ESubs- [Team Bindass].txt,His medicines. May I say something? - Go ahead. I'll  always be proud of the fact that I was your wife. You wanted to see success again. And today you've tasted it. What good is this success for me? 
p1484_bolly,Kab Kyoon Aur Kahan.txt,Come with me. - Let's go. Mr. Jagdish Prasad? You are his daughter? You know my father? - Who doesn't know......a philanthropist like him. He is the pride of our city. Who is he? - He is my uncle. My father's step-brother. I see. - But he loves him more than own brother. 
p1485_bolly,Kabeela 1976.txt," My brave lad! Great my son; great! Today you have made the entire tribe very proud. Mother, after all I am your son. Hey you mother's son! "
p1486_bolly,Kabhi Haan Kabhi Naa 1994 Hindi 720p HDRip 02-03-2019.txt," You can ask me, your Dad, can't you. I'll give however much you want, my son. Considering you're such a good son...And how proud I'm of you. For failing not once or even twice but THRICE! In all subjects on one occasion! "
p1487_bolly,Kabhi Haan Kabhi Naa 1994 Hindi 720p HDRip 02-03-2019.txt," Friends, I want to tell you something. All that I said about Sunil just a while ago......is all wrong. That he made us happy... and we were proud of him...That our blessing're with him... all that is wrong. All of you came here to celebrate with us......because Sunil passed with a first class. It's false... everything's false. "
p1488_bolly,Kabhi Haan Kabhi Naa 1994 Hindi 720p HDRip 02-03-2019.txt," It shows how pure of heart Sunil is! Sunil hasn't failed...He has passed with cent percent marks! You should be proud to have a son like him, Vinayak! If you feel what I said is right...Say that you've forgiven Sunil. Say it, Vinayak. Listen, Vinayak...You have to say you have forgiven Sunil. "
p1489_bolly,Kabhi Kabhie (1976) - DVDRip - 1CD - XviD - M-Subs - [DUS] - Extra Subs.txt," She is my poetry. if anyone tries to hurt her, I'll  make her life miserable...be it even my wife. I feel so proud of you. But you enrage me! I wish I could kill myself! A mother has to bear much. But how much? For how long? "
p1490_bolly,Kabhi Kabhie (1976) - DVDRip - 1CD - XviD - M-Subs - [DUS] - Extra Subs.txt," Young fellow! When I was of your age, I'd do the pentathlon! C'mon They call me Vijay Khanna. - They call me Vikram Khanna. Pleased to meet you. - I'm proud of you my son Thank you, Dad - Excuse me...?Yes. This Romeo is my son. You shouldn't have hidden it from me. "
p1491_bolly,Kabhi Kabhie (1976) - DVDRip - 1CD - XviD - M-Subs - [DUS] - Extra Subs.txt," Your memories... the only thing I treasure in my life. Please, let me keep what little I have left. I feel so proud. But I'm sad too. My memories are the cause of your sorrow. I feel guilty. "
p1492_bolly,Kabhi Kabhie (1976) - DVDRip - 1CD - XviD - M-Subs - [DUS] - Extra Subs.txt," You met me. You came home with me. Had you told me that you were in love with Pooja...my respect for you would've increased tenfold. This is a matter of pride for me! Pooja is so beautiful! Men would lay down their lives for her! Believe me, I respect you. And I respect your opinion. "
p1493_bolly,Kabhi Kabhie (1976) - DVDRip - 1CD - XviD - M-Subs - [DUS] - Extra Subs.txt," Are you a God or something? My darling, it is achievement enough if a man is humane. Believe me, I'm very proud of you! What are you thinking about? What if you hadn't come here, what then? "
p1494_bolly,Kabhi Kabhie (1976) - DVDRip - 1CD - XviD - M-Subs - [DUS] - Extra Subs.txt," What? Sorry, Papa Are you all right? I'm proud of you my son! Are you all right Sweety? - I'm fine. Forgive me, Pinky. I didn't know about you and Vicky. "
p1495_bolly,Kabhi Khushi Kabhie Gham DVDRip.x264.MP4.txt," And maybe I will never be able to do it because...there's no one in this world like my Papa. I know that someone up there is happy with me to have bestowed on...me the right to say that I am Yashvardhan Raichand's son. Say it proudly. We just want to say to you that we love you very much. I'll just have a look. Grandmother, you come with me. "
p1496_bolly,Kabhi Khushi Kabhie Gham DVDRip.x264.MP4.txt,He understands my emotions... he understands every breath of mine. I was so wrong... so wrong. I was really proud of you. You were my self-respect. You were my strength. You have taken all that away from me... everything. 
p1497_bolly,Kabhi.Haan.Kabhi.Naa.1993.CD1.DVDRip.XviD-BrG.txt," you can ask me, your Dad, can't you I'll give however much you want, my son Considering you're such a good son...And how proud I'm of you For failing not once or even twice but THRICE! In all subjects on one occasion! "
p1498_bolly,Kabhi.Haan.Kabhi.Naa.1993.CD2.DVDRip.XviD-BrG.txt," Friends, I want to tell you something All that I said about Sunil just a while ago......is all wrong That he made us happy... and we were proud of him...That our blessing are with him... all that is wrong All of you came here to celebrate with us......because Sunil passed with a first class It's false... everything's false "
p1499_bolly,Kabhi.Haan.Kabhi.Naa.1993.CD2.DVDRip.XviD-BrG.txt," It shows how pure of heart Sunil is! Sunil hasn't failed...He has passed with cent percent marks! you should be proud to have a son like him, vinayak! If you feel what I said is right...Say that you've forgiven Sunil. Say it, vinayak Listen, vinayak...you have to say you have forgiven Sunil "
p1500_bolly,Kabhi.Khushi.Kabhie.Gham[2001]BDRip.720p[Hin.Rus]-Junoon_track4_eng.txt,"And maybe I will never be able to do it because...there's no one in this world like my Papa. I know that someone up there is happy with me to have bestowed on...me the right to say that I am Yashvardhan Raichand's son. Say it proudly. I, and the 3 most beautiful women in the world Thank you...and the 3 most beautiful women in the world...Miss world, Miss Universe, Miss Asia-Pacific and....fatty"
p1501_bolly,Kabhi.Khushi.Kabhie.Gham[2001]BDRip.720p[Hin.Rus]-Junoon_track4_eng.txt,He understands my emotions... he understands every breath of mine. I was so wrong... so wrong. I was really proud of you. You were my self-respect. You were my strength. You have taken all that away from me... everything. 
p1502_bolly,Kabir.Singh.2019.1080p.NF.WEB-DL.DD+5.1.x264-Tellyy.txt,But now that I am away from you Why should I stay away from you? I am your pride Let's fill this void right now You were my dream come true 
p1503_bolly,Kabir.Singh.2019.1080p.NF.WEB-DL.DD+5.1.x264-Tellyy.txt," She loved me. What did her father say? My pride! My reputation! That's utter bullshit. If Preeti and I were together, we would have had a family. "
p1504_bolly,Kabir.Singh.2019.1080p.NF.WEB-DL.DD+5.1.x264-Tellyy.txt," That's utter bullshit. If Preeti and I were together, we would have had a family. But because of the my pride factor, we got divided and that baby will never see the face of this earth. I am sure he knows about us. "
p1505_bolly,Kabir.Singh.2019.1080p.NF.WEB-DL.DD+5.1.x264-Tellyy.txt," Look at Dad, Karan. Kabir, just shut up. I am proud of one thing in my life. My career is the only thing that I am proud of. Oh, God! "
p1506_bolly,Kabir.Singh.2019.1080p.NF.WEB-DL.DD+5.1.x264-Tellyy.txt," Kabir, just shut up. I am proud of one thing in my life. My career is the only thing that I am proud of. Oh, God! Kabir, we'll talk about this later. "
p1507_bolly,Kabir.Singh.2019.1080p.NF.WEB-DL.DD+5.1.x264-Tellyy.txt," Did you consume alcohol or some other chemical intoxicants? And, the day before that. But I never caused discomfort to any of my patients and I am proud of that. The hospital management and the staff have nothing to do with it. Your medical license will be seized for five years. "
p1508_bolly,Kachche Dhaage 1999 Hindi 720p HDRip x264 AC3 - Hon3y.txt," You are here. I know everything about you. I have got the record of yours. You have a lot of pride, don't you? You are the betrayers of the country. You have become a burden on us. "
p1509_bolly,Kachche Dhaage 1999 Hindi 720p HDRip x264 AC3 - Hon3y.txt,You make the separated ones meet. You make the separated ones meet. And they lead a proud life because of your grace. The greatness of this place is beyond expression! The greatness of this place is beyond expression! 
p1510_bolly,Kachche Dhaage 1999 Hindi 720p HDRip x264 AC3 - Hon3y.txt," The explosives that we got the orders to destroy. And you are selling those to the enemy. Wow! I am really proud of you. Jadeja! What is going on, Bhakta? "
p1511_bolly,Kachche Dhaage 1999 Hindi 720p HDRip x264 AC3 - Hon3y.txt,You make the separated ones meet. You make the separated ones meet. And they lead a proud life because of your grace. The greatness of this place is beyond expression! The greatness of this place is beyond expression! 
p1512_bolly,Kachche Dhaage 1999 Hindi DvDRip x264 AC3 5.1...Hon3y.txt," You trained under me and you give a dodge to a man like me'? The arms that we were to destroy, you wanted to sell it to the foe'? We're very proud of you! What the hell's going on'? - I followed you to this place, sir. I saw that he had knocked you out. He wanted to kill, but I stopped him. "
p1513_bolly,Kachche Dhaage(1999).txt," You are here. I know everything about you. I have got the record of yours. You have a lot of pride, don't you? You are the betrayers of the country. You have become a burden on us. "
p1514_bolly,Kachche Dhaage(1999).txt,You make the separated ones meet. You make the separated ones meet. And they lead a proud life because of your grace. The greatness of this place is beyond expression! The greatness of this place is beyond expression! 
p1515_bolly,Kachche Dhaage(1999).txt," All these days you were under me..And you fooled a person like me? The explosives that we got the orders to destroy..And you are selling those to the enemy. Wow! I am really proud of you. Jadeja! What is going on, Bhakta? "
p1516_bolly,Kachche Dhaage(1999).txt,You make the separated ones meet. You make the separated ones meet. And they lead a proud life because of your grace. The greatness of this place is beyond expression! The greatness of this place is beyond expression! 
p1517_bolly,Kaho Naa... Pyaar Hai 2000 Hindi 720p DvDRip CharmeLeon SilverRG.txt,Our eyes now speak Of secrets Your secrets My secret pride What do they say Your heart I want 
p1518_bolly,Kal Aaj Aur Kal (1971).txt," Now I realise that if our love is rooted in the sorrows of our elders...our happiness will be short-lived If you want to give vent, call me a fraud, selfish, treacherous man...whatever you wish. I'll put up with it No Rajesh! You're right in whatever you're doing. For you, for me...for all of us belonging to this proud, pissed-off generation...this sacrifice is the acid test Go Rajesh. Marry the girl of your grandfather's choice And look, I'm no fool. Don't you forget to invite me for the wedding "
p1519_bolly,Kal Ho Naa Ho (2003)[720p.BluRayRip.x264]AC-3.txt,The  colour of  gold...''the  colour of crystal...'' the sight leaves me  breathless... I'm amazed What trait is this...?''why're there so much of pride...?'' what secret is it...? How will I say it Happy in a moment and angry too...''she changes  colours every moment'' 
p1520_bolly,Kal Ho Naa Ho (2003)[720p.BluRayRip.x264]AC-3.txt," U... G-U-J-J-U G-U-J-J-U Gujju, Gujju... Rohit and Naina...''we are proud of you'' ''Gujju!'' It's okay.  Should we call Kunwari Kudi again? - Shut up! "
p1521_bolly,"Kala Bazaar 1989. Varianta, Einthusan.txt"," Don't think we are easy. If it wouldn't have been for lovers. How would you have felt so proud? Beauty and love is dependent on us. We will defeat you, in the game of love. "
p1522_bolly,Kalank 2019 - ALL Web - HDRip ENGLISH.txt," And on the other side there's Balraj Chaudhry...Who was denying my existence till yesterday...And today, he's here to beg from me. What do you want? That I should beg you for the pride of my family? Leave them alone! But that's your legacy...To leave your dear ones. "
p1523_bolly,Kali Salwaar - (2002) - DVDRiP 1CD - x264 - AAC - Chapters Esubs - [DDR]_track3_eng.txt,That's not the issue Manto. Then what's the problem? M'ahmmed bhai now seeks his lost pride in other's eyes. It's beyond your understanding Manto. They could have hung me and I wouldn't have cared. 
p1524_bolly,Kandukondain.Kandukondain.2000.Tamil.DvDRip.XviD.AC3.Subs.txt," We are meeting again and again; Take it We will be pride, if your daughters sing in our function. Not  only that, boys who earn in   Dollar & pounds will  also come; It will be a good opportunity for the marriage too; "
p1525_bolly,Kandukondain.Kandukondain.2000.Tamil.DvDRip.XviD.AC3.Subs.txt," You don't know about me; If there is anything then  only you can throw it out; What! Are you proud? Won't give you, If we have? You don't know about our  family; "
p1526_bolly,Kandukondain.Kandukondain.2000.Tamil.DvDRip.XviD.AC3.Subs.txt,Leave it sir. Are you mad? All are saying that you sing well no? That proudness! Go and ask  apology to  Bala.  Always like this  only; 
p1527_bolly,KanyaDaan(1).txt," It'll be ready in a month. Wait. Your intentions are noble, no doubt But I hope this kind of help does not hurt their pride - Okay, aunt. I'll leave now. - Have tea and go. No, I'll get late. Thank you very much. "
p1528_bolly,KanyaDaan.txt," It'll be ready in a month. Wait. Your intentions are noble, no doubt But I hope this kind of help does not hurt their pride - Okay, aunt. I'll leave now. - Have tea and go. No, I'll get late. Thank you very much. "
p1529_bolly,Kapoor _ Sons (2016)-HEVC-x265.AAC.Esubs-DDR.English(1).txt," Do you know why I'm always taking up new things?! I wanted to prove myself! I wanted to do something to make you feel proud! And today, you've snatched that from me! I'm sorry...I should never have given him your story...Mom, this isn't about the goddamn story! "
p1530_bolly,Kapoor _ Sons (2016)-HEVC-x265.AAC.Esubs-DDR.English.txt," Do you know why I'm always taking up new things?! I wanted to prove myself! I wanted to do something to make you feel proud! And today, you've snatched that from me! I'm sorry...I should never have given him your story...Mom, this isn't about the goddamn story! "
p1531_bolly,Karan Arjun (1995) Disc - 1(1).txt,Don't cry son. Our son will grow into a big man. Even God will feel proud of him. All thanks to Pestonbhai. I work in his Riding Club and eke out a living. 
p1532_bolly,Karan Arjun (1995) Disc - 1(1).txt,Arrest him! We are Thakurs by birth. Pride and anger courses through our veins along with blood. Whenever our women step in the quicksand of disrepute...We have them buried alive in the walls of our homes! But the love of my son holds me back. 
p1533_bolly,Karan Arjun (1995) Disc - 1.txt,Don't cry son. Our son will grow into a big man. Even God will feel proud of him. All thanks to Pestonbhai. I work in his Riding Club and eke out a living. 
p1534_bolly,Karan Arjun (1995) Disc - 1.txt,Arrest him! We are Thakurs by birth. Pride and anger courses through our veins along with blood. Whenever our women step in the quicksand of disrepute...We have them buried alive in the walls of our homes! But the love of my son holds me back. 
p1535_bolly,Karan Arjun 1995 Hindi 720p DvDRip x264 AC3.Hon3y(1).txt,Don't cry son. Our son will grow into a big man. Even God will feel proud of him. All thanks to Pestonbhai. I work in his Riding Club and eke out a living. 
p1536_bolly,Karan Arjun 1995 Hindi 720p DvDRip x264 AC3.Hon3y(1).txt,Arrest him! We are Thakurs by birth. Pride and anger courses through our veins along with blood. Whenever our women step in the quicksand of disrepute...We have them buried alive in the walls of our homes! But the love of my son holds me back. 
p1537_bolly,Karan Arjun 1995 Hindi 720p DvDRip x264 AC3.Hon3y.txt,Don't cry son. Our son will grow into a big man. Even God will feel proud of him. All thanks to Pestonbhai. I work in his Riding Club and eke out a living. 
p1538_bolly,Karan Arjun 1995 Hindi 720p DvDRip x264 AC3.Hon3y.txt,Arrest him! We are Thakurs by birth. Pride and anger courses through our veins along with blood. Whenever our women step in the quicksand of disrepute...We have them buried alive in the walls of our homes! But the love of my son holds me back. 
p1539_bolly,Karan.Arjun.DVDRip.x264.BY.tamercome(1).txt,Don't cry son. Our son will grow into a big man. Even God will feel proud of him. All thanks to Pestonbhai. I work in his Riding Club and eke out a living. 
p1540_bolly,Karan.Arjun.DVDRip.x264.BY.tamercome(1).txt,Arrest him! We are Thakurs by birth. Pride and anger courses through our veins along with blood. Whenever our women step in the quicksand of disrepute...We have them buried alive in the walls of our homes! But the love of my son holds me back. 
p1541_bolly,Karan.Arjun.DVDRip.x264.BY.tamercome.txt,Don't cry son. Our son will grow into a big man. Even God will feel proud of him. All thanks to Pestonbhai. I work in his Riding Club and eke out a living. 
p1542_bolly,Karan.Arjun.DVDRip.x264.BY.tamercome.txt,Arrest him! We are Thakurs by birth. Pride and anger courses through our veins along with blood. Whenever our women step in the quicksand of disrepute...We have them buried alive in the walls of our homes! But the love of my son holds me back. 
p1543_bolly,Karishma Kali Ka 1990(1).txt," Sir, I had a request. Shiva, you need not tell me. Police department is proud of you....because of your loyalty and honesty with Law. Thank you, sir. - And that's why I'm giving you....Kaali temple case as the top priority. I'm here to arrest you under the charges of....Kaali temple's priest's murder and robbery. "
p1544_bolly,Karishma Kali Ka 1990(1).txt,He's blinded by law. And he can't see anything other than the evidence. It's a matter of proud to be a mother of such son. Otherwise justice is unstained today. Nobody puts stain on it. 
p1545_bolly,Karishma Kali Ka 1990.txt," Sir, I had a request. Shiva, you need not tell me. Police department is proud of you....because of your loyalty and honesty with Law. Thank you, sir. - And that's why I'm giving you....Kaali temple case as the top priority. I'm here to arrest you under the charges of....Kaali temple's priest's murder and robbery. "
p1546_bolly,Karishma Kali Ka 1990.txt,He's blinded by law. And he can't see anything other than the evidence. It's a matter of proud to be a mother of such son. Otherwise justice is unstained today. Nobody puts stain on it. 
p1547_bolly,Karishma Kudrat Kaa 1985.txt,I would have been hanged till death. But all the brothers in this world would have raised their heads with pride. 'Enmity with Karan can turn out to be expensive to you.' 'He can even put you in jail. The best thing is to save yourself.' 
p1548_bolly,Karishma Kudrat Kaa 1985.txt," He is a demon. He is a devil. Karan, it is easy to do sins. But very hard to wash away your sins. I'll be proud to marry a man like you. Don't think so much, Karan. Just put your hands forward. Put this vermilion in my scalp and make me a married woman. "
p1549_bolly,Karishma.Kudrat.Kaa.1985.DVDRip ANG SUB.1.37GB.txt,Had I not been a servant of law. I would have killed you in such a way that though......I would have been hanged till death. But all the brothers in this world would......have raised their heads with pride. 'Enmity with Karan can turn out to be expensive to you.' 'He can even put you in jail. The best thing is to save yourself.' 
p1550_bolly,Karishma.Kudrat.Kaa.1985.DVDRip ANG SUB.1.37GB.txt," He is a demon. He is a devil. Karan, it is easy to do sins. But very hard to wash away your sins. I'll be proud to marry a man like you. Don't think so much, Karan. Just put your hands forward. Put this vermilion in my scalp and make me a married woman. "
p1551_bolly,Kartoos.txt,"And the minister  himself rang me   personally and expressed . . Satisfaction with the working of the Special Task Force . . . .and he said that the  whole country is proud of these officers . He has announced that, as before , the  relatives of the dead . . . .will receive Rs 50000 and those  seriously injured will . ."
p1552_bolly,Karz.1980.DVDRip.XviD.Subs.-=Team XDM=-.txt," Our school. After sometime, we will go to that hall and....you shall inaugurate the hall. People will applaud and envy the pride and status....of Mrs. Shanta Prasad Verma. God bless you, son! After that we will go to our palace. Yes, mother! We will go to our house. "
p1553_bolly,Kasam ((2001) DvDrip x264 - AC3 - E.sub.txt,"How dare you...how did you dare? He threatens me? I must break his pride - First, we must isolate him Shankar, listen...Shankar, hold it... hold it, or even I shall raise my hand To which end, he must go far away from here for 4, maybe 6 years"
p1554_bolly,Kasme.vaade.dvdrip.BY.tamercome.avi.txt," You are what the dreams were all about You are my life You are my pride In your arms...''in your arms...'' In your arms, embrace me forever "
p1555_bolly,Kasoor (2001)[DVDRip.x264]AC-3.txt," That I didn't want to Leave shouldn’t surprise you. I should be surprised Today in court I watched you put up that fight in earnest, for my sake And my heart swelled in pride For the first time, I have felt, here's someone who trusts me...someone who sees my innocence. Oh, how I wish I were Lost How can I go away from you? I'm so close to you...I can even reach out and touch you. To tell you the truth, the sight...of you sitting on the stairs, cradling the phone...waiting for me, makes me feel nice. I wish I could pick you up...in my arms, and take you  someplace far away "
p1556_bolly,Kasoor 2001 Hindi 720p DvDRip x264 AC3 5.1...Hon3y.txt," That I didn't want to leave shouldn't surprise you. I should be surprised Today in court I watched you put up that fight in earnest, for my sake And my heart swelled in pride For the first time, I have felt, here's someone who trusts me...someone who sees my innocence. Oh, how I wish I were lost How can I go away from you? I'm so close to you...I can even reach out and touch you. To tell you the truth, the sight...of you sitting on the stairs, cradling the phone...waiting for me, makes me feel nice. I wish I could pick you up...in my arms, and take you someplace far away "
p1557_bolly,Katha 1983.txt," 'How much more will the bonds of your love, pull me?' 'How much more will the bonds of your love, pull me?' 'Leave me, give me back my pride.' 'I didn't ask you for anything' Will you put this too? "
p1558_bolly,Katilon Ke kaatil 1981.DVDRip.XviD.E.Sub.sub.txt," Michael, Black Cobra here. Black Cora, I have the chariot and i'm coming to you, yes, ok. Wonderful, Michael. i'm proud of you. i'm proud. Michael, what happened? Oh my God! No! - Doctor sir. "
p1559_bolly,Katilon Ke kaatil 1981.DVDRip.XviD.E.Sub.sub.txt,There's no place for weak ways over here. These are the ways of a lover. it'll tear your heart. it'll bring the face of a proud person on its feet. Tell him that that might be someone else. Then what are you? 
p1560_bolly,Katilon Ke kaatil 1981.DVDRip.XviD.E.Sub.sub.txt," She is sitting with the lamps of life in the wind. The lamps of life. Then too, why are men so proud about their power? Then too, why are men so proud about their power? its women, who have defeated death. "
p1561_bolly,Katilon Ke kaatil 1981.DVDRip.XviD.E.Sub.sub.txt," The lamps of life. Then too, why are men so proud about their power? Then too, why are men so proud about their power? its women, who have defeated death. its women. its women. "
